{"$schema":"http://json-schema.org/draft-07/schema#","$id":"https://full-video-pipeline/animations/rolling-digit-counter.schema.json","title":"RollingDigitCounter instance","type":"object","additionalProperties":false,"required":["extras"],"properties":{"$schema":{"type":"string"},"instanceId":{"type":"string"},"theme":{"$ref":"https://full-video-pipeline/schemas/animations.schema.json#/definitions/theme"},"global":{"$ref":"https://full-video-pipeline/schemas/animations.schema.json#/definitions/global"},"elements":{"type":"array","items":{"type":"object","additionalProperties":true,"required":["id"],"properties":{"id":{"type":"string","enum":["value","label","prefix","suffix"]},"text":{"type":["string","null"]},"delay":{"type":["number","null"],"minimum":0,"maximum":60000},"duration":{"type":["number","null"],"minimum":1,"maximum":60000},"easing":{"$ref":"https://full-video-pipeline/schemas/animations.schema.json#/definitions/easingName"},"position":{"$ref":"https://full-video-pipeline/schemas/animations.schema.json#/definitions/element/properties/position"},"size":{"type":"object","additionalProperties":false,"properties":{"fontSize":{"type":["number","null"],"minimum":4,"maximum":1000},"scale":{"type":["number","null"],"minimum":0.05,"maximum":20}}},"color":{"$ref":"https://full-video-pipeline/schemas/animations.schema.json#/definitions/element/properties/color"},"hidden":{"type":"boolean","default":false},"custom":{"type":"object"}}}},"extras":{"type":"object","additionalProperties":false,"required":["targetValue"],"properties":{"targetValue":{"type":"number"},"decimals":{"type":"integer","minimum":0,"maximum":4,"default":0},"thousandSeparator":{"type":"string","enum":["",",","."],"default":""},"rollSeconds":{"type":"number","minimum":0.4,"maximum":6,"default":1.6},"spinRateHz":{"type":"number","minimum":4,"maximum":30,"default":12},"headstartFrames":{"type":"integer","minimum":0,"maximum":120,"default":6},"perColumnStagger":{"type":"number","minimum":0,"maximum":0.5,"default":0.15},"motionBlur":{"type":"number","minimum":0,"maximum":20,"default":4,"description":"Deprecated alias mapped to motionBlurScale=motionBlur/4 when motionBlurScale is absent."},"motionBlurScale":{"type":"number","minimum":0,"maximum":3,"default":1},"springLand":{"type":"boolean","default":true},"valueFontRole":{"type":"string","enum":["heading","mono"],"default":"mono"},"rowGapPx":{"type":"number","minimum":0,"maximum":400,"default":24},"maxFontPx":{"type":"number","minimum":8,"maximum":1000,"default":260},"containerWidthPct":{"type":"number","minimum":30,"maximum":100,"default":70},"frameColor":{"type":["string","null"],"default":null},"accentColor":{"type":["string","null"],"default":null},"lockAccent":{"type":"boolean","default":true},"showStamp":{"type":"boolean","default":false},"label":{"type":["string","null"],"default":null,"description":"Shortcut for the label element text; the element id label overrides this if set."},"holdAfterLandFrames":{"type":"integer","minimum":0,"maximum":600,"default":24}}}}}