{"instanceId":"rolling-digit-counter.defaults","theme":{},"global":{"speed":1,"delayOffset":0,"easing":"ease-out-cubic"},"elements":[],"extras":{"targetValue":100,"decimals":0,"thousandSeparator":"","rollSeconds":1.6,"spinRateHz":12,"headstartFrames":6,"perColumnStagger":0.15,"motionBlurScale":1,"springLand":true,"valueFontRole":"mono","rowGapPx":24,"maxFontPx":260,"containerWidthPct":70,"frameColor":null,"accentColor":null,"lockAccent":true,"showStamp":false,"label":null,"holdAfterLandFrames":24}}